transaccion_id,fecha_transaccion,tipo_transaccion,estado,monto_total,metodo_pago,cliente_nombre,cliente_telefono,cliente_localidad,producto_id,producto_nombre,producto_talla,producto_color,producto_temporada,cantidad_comprada,vestido_estilo,vestido_precio_venta,vestido_precio_renta,vestido_en_oferta,vestido_condicion,vestido_rating_promedio,vestido_review_count,fecha_entrega,fecha_devolucion,multa_aplicada,reseña_rating,reseña_comentario,fecha_reseña
687fb20a4cc6239222226266,2023-10-23 10:30:45,renta,Completada,579,tarjeta_debito,camila.gonzalez@email.com,5534567890,Huejutla de Reyes,687c1d9a555de7433ad30ab1,Vestido Largo Turquesa con Cuello Halter,S,Turquesa,"Verano, Primavera",1,De Noche,2900,,false,Nuevo,4.6,18,2023-10-24 00:30:45,2023-11-07 00:30:45,60,4,"Me fascinó cómo me quedó, ¡lo recomiendo a todas mis amigas!",2023-12-02 10:30:45
687fb20a4cc6239222226267,2023-08-26 04:47:45,renta,Completada,934,tarjeta_credito,sheldon@gmail.com,5551234567,Platón Sánchez,687e0d4b8639b437a0e4877c,Vestido Kimono Estampado Japonés,L,Multicolor,"Primavera, Verano",1,Casual/Formal,1300,,false,Nuevo,4.4,6,2023-08-27 02:47:45,2023-09-07 02:47:45,0,4,¡Absolutamente precioso! Recibí muchos cumplidos.,2023-10-01 04:47:45
687fb20a4cc6239222226268,2023-03-18 04:55:18,Venta,Completada,1300,transferencia_bancaria,camila.gonzalez@email.com,5534567890,Huejutla de Reyes,687e0dd08639b437a0e487b2,Vestido de Punto Grueso con Cuello Alto,M,Gris,Invierno,1,Casual,1300,,false,Nuevo,3.7,6,2023-03-19 04:55:18,,0,4,"El vestido superó mis expectativas, ¡lo recomiendo totalmente!",2023-04-16 04:55:18
687fb20a4cc6239222226269,2023-05-07 05:02:50,renta,Completada,486,transferencia_bancaria,ia.perez@example.com,1234567897,Chalma,687e0dd08639b437a0e487c9,Vestido Largo de Gasa con Estampado de Geométrico,L,Gris/Negro,Todo el Año,1,Formal/Casual,1400,,false,Nuevo,4.3,8,2023-05-08 02:02:50,2023-05-14 02:02:50,0,4,"Me fascinó cómo me quedó, ¡lo recomiendo a todas mis amigas!",2023-05-18 05:02:50
687fb20a4cc623922222626a,2023-04-07 05:00:19,Venta,Completada,1300,tarjeta_debito,valentina.rodriguez@email.com,5587654321,Guazalingo,687e0dd08639b437a0e487b2,Vestido de Punto Grueso con Cuello Alto,M,Gris,Invierno,1,Casual,1300,,false,Nuevo,3.7,6,2023-04-07 10:00:19,,0,4,Un diseño hermoso y la atención fue de primera. Volveré sin duda.,2023-05-21 05:00:19
687fb20a4cc623922222626b,2023-01-11 11:49:12,renta,Completada,850,tarjeta_credito,sofia.garcia@email.com,5512345678,Jaltocán,687e0d4b8639b437a0e4877b,Vestido de Noche con Abertura Lateral,S,Rojo Oscuro,Todo el Año,1,De Noche,2600,850,false,Nuevo,4.8,12,2023-01-12 02:49:12,2023-01-28 02:49:12,0,5,"Me fascinó cómo me quedó, ¡lo recomiendo a todas mis amigas!",2023-02-09 11:49:12
687fb20a4cc623922222626c,2023-01-11 11:32:37,renta,Completada,950,transferencia_bancaria,ana.lopez@example.com,1234567891,Atlapeza,687e0d4b8639b437a0e48779,Vestido de Fiesta Corto con Brillos,S,Oro Rosa,Todo el Año,1,Fiesta,,950,false,Nuevo,4.6,7,2023-01-11 22:32:37,2023-01-23 22:32:37,83,5,¡Excelente vestido! Me encantó el servicio en el local.,2023-01-30 11:32:37
687fb20a4cc623922222626d,2023-01-08 08:33:51,renta,Completada,850,efectivo,alejandra.paredes@example.com,1234567827,Huejutla de Reyes,687e0dd08639b437a0e487a9,Vestido de Fiesta con Escote Corazón,L,Rosa Empolvado,Todo el Año,1,Fiesta,2500,850,false,Nuevo,4.7,10,2023-01-08 23:33:51,2023-01-15 23:33:51,0,5,"Quedó perfecto para la ocasión, muy contenta con la compra/renta.",2023-02-19 08:33:51
687fb20a4cc623922222626e,2023-08-22 04:47:43,renta,Completada,750,efectivo,adriana.romero@example.com,1234567817,San Felipe Orizatlán,687e0dd08639b437a0e4879f,Vestido de Noche Corto con Pedrería,M,Negro,Todo el Año,1,Cóctel,2100,750,false,Nuevo,4.7,9,2023-08-22 16:47:43,2023-08-27 16:47:43,0,4,"La tela es de muy buena calidad, y el vestido es aún más bonito en persona.",2023-09-19 04:47:43
687fb20a4cc623922222626f,2023-12-03 08:37:28,renta,Completada,600,efectivo,patricia.guzman@example.com,1234567819,Guazalingo,687e0dd08639b437a0e487af,Vestido de Cóctel con Escote Peter Pan,S,Rosa Pastel,Todo el Año,1,Cóctel,1650,600,false,Nuevo,4.5,7,2023-12-04 01:37:28,2023-12-17 01:37:28,0,3,"Me gustó, aunque el color en persona es ligeramente diferente.",2023-12-30 08:37:28
687fb20a4cc6239222226271,2023-12-12 12:30:25,renta,Completada,2000,tarjeta_debito,alejandra.paredes@example.com,1234567827,Huejutla de Reyes,687e0d118639b437a0e48764,Vestido de Gala Rosa Pastel,M,Rosa Pastel,Todo el Año,1,Gala,,2000,false,Nuevo,4.8,13,2023-12-12 21:30:25,2023-12-27 21:30:25,0,4,¡Absolutamente precioso! Recibí muchos cumplidos.,2024-01-12 12:30:25
687fb20a4cc6239222226272,2023-09-07 06:33:30,Venta,Completada,920,transferencia_bancaria,camila.gonzalez@email.com,5534567890,Huejutla de Reyes,687e0dd08639b437a0e48784,Vestido de Tirantes con Estampado Tropical,S,Verde/Azul/Amarillo,Verano,1,Casual,920,,false,Nuevo,4.3,16,2023-09-07 18:33:30,,0,5,"Un acierto total, justo lo que buscaba y a un excelente precio.",2023-09-21 06:33:30
687fb20a4cc6239222226273,2023-05-22 06:35:37,renta,Completada,308,efectivo,alejandra.paredes@example.com,1234567827,Huejutla de Reyes,687e0dd08639b437a0e4879b,Vestido Largo Estampado Étnico con Aberturas,L,Multicolor,Verano,1,Bohemio,1050,,false,Nuevo,4.2,13,2023-05-22 13:35:37,2023-06-04 13:35:37,0,4,"Me fascinó cómo me quedó, ¡lo recomiendo a todas mis amigas!",2023-06-20 06:35:37
687fb20a4cc6239222226274,2023-05-19 10:36:43,renta,Completada,1329,efectivo,laura.hernandez@example.com,1234567895,Choconamel,687e0d118639b437a0e4876a,Vestido de Punto Básico Beige,M,Beige,"Otoño, Invierno",1,Casual,800,,false,Nuevo,3.5,7,2023-05-19 15:36:43,2023-05-27 15:36:43,0,5,"La tela es de muy buena calidad, y el vestido es aún más bonito en persona.",2023-06-08 10:36:43
687fb20a4cc6239222226275,2023-05-12 04:47:52,renta,Completada,1800,efectivo,maria.gonzalez@example.com,1234567893,Atlapeza,687e0d4b8639b437a0e4876e,Vestido de Noche con Cola de Sirena y Bordados,M,Azul Marino,Todo el Año,1,De Noche,,1800,false,Nuevo,4.9,15,2023-05-12 18:47:52,2023-05-21 18:47:52,0,4,"El vestido superó mis expectativas, ¡lo recomiendo totalmente!",2023-06-24 04:47:52
687fb20a4cc6239222226276,2023-12-18 08:18:52,Venta,Completada,4000,efectivo,isabel.vargas@example.com,1234567815,Choconamel,687c108a555de7433ad30a6b,Escarlata Real,M,Rojo,Todo el Año,1,De Noche,4000,,false,Nuevo,4.9,25,2023-12-19 08:18:52,,0,4,"Quedó perfecto para la ocasión, muy contenta con la compra/renta.",2024-01-03 08:18:52
687fb20a4cc6239222226277,2023-04-25 03:08:03,renta,Completada,399,tarjeta_credito,gabriela.silva@example.com,1234567821,Atlapeza,687e0dd08639b437a0e48792,Vestido de Punto Grueso con Trenzas,M,Marrón Chocolate,Invierno,1,Casual,1450,,false,Nuevo,4,6,2023-04-26 03:08:03,2023-05-09 03:08:03,0,5,"Un acierto total, justo lo que buscaba y a un excelente precio.",2023-05-23 03:08:03
687fb20a4cc6239222226278,2023-04-11 08:59:01,Venta,Completada,1200,tarjeta_credito,patricia.guzman@example.com,1234567819,Guazalingo,687e0d118639b437a0e48758,Vestido Cóctel Rojo Vibrante,S,Rojo,"Primavera, Verano",1,Cóctel,1200,,false,Nuevo,4.2,8,2023-04-11 22:59:01,,0,2,Podría mejorar la limpieza/condición del vestido al entregarlo.,2023-05-13 08:59:01
687fb20a4cc623922222627a,2023-06-11 07:00:34,renta,Completada,6800,efectivo,maria.gonzalez@example.com,1234567893,Atlapeza,687e0dd08639b437a0e487cb,Vestido de Novia con Escote de Hombros Caídos,M,Marfil,Todo el Año,1,Nupcial,19000,6800,false,Nuevo,4.9,27,2023-06-11 19:00:34,2023-06-23 19:00:34,0,1,El vestido no cumplió con mis expectativas de calidad.,2023-06-29 07:00:34
687fb20a4cc623922222627b,2023-05-06 07:04:12,Venta,Completada,1650,tarjeta_credito,sheldon@gmail.com,5551234567,Platón Sánchez,687e0dd08639b437a0e487af,Vestido de Cóctel con Escote Peter Pan,S,Rosa Pastel,Todo el Año,1,Cóctel,1650,600,false,Nuevo,4.5,7,2023-05-06 14:04:12,,0,1,Podría mejorar la limpieza/condición del vestido al entregarlo.,2023-06-04 07:04:12
687fb20a4cc623922222627c,2023-07-22 07:45:18,Venta,Completada,1800,tarjeta_credito,daniela.mendoza@example.com,1234567822,Huejutla de Reyes,687e0d4b8639b437a0e4876b,Vestido de Encaje Blanco Vintage,M,Blanco,"Primavera, Verano",1,Vintage,1800,650,false,Nuevo,4.7,10,2023-07-22 14:45:18,,0,5,"Quedó perfecto para la ocasión, muy contenta con la compra/renta.",2023-08-05 07:45:18
687fb20a4cc623922222627d,2023-05-20 06:41:56,renta,Completada,700,tarjeta_credito,isabel.vargas@example.com,1234567815,Choconamel,687e0d4b8639b437a0e4876c,Vestido Tubo Elástico Negro,S,Negro,Todo el Año,1,Casual/Cóctel,900,,false,Nuevo,4.1,18,2023-05-21 04:41:56,2023-06-01 04:41:56,0,5,¡Absolutamente precioso! Recibí muchos cumplidos.,2023-07-01 06:41:56
687fb20a4cc623922222627f,2023-07-06 11:07:44,Venta,Completada,1300,tarjeta_credito,alejandra.paredes@example.com,1234567827,Huejutla de Reyes,687e0d4b8639b437a0e4877c,Vestido Kimono Estampado Japonés,L,Multicolor,"Primavera, Verano",1,Casual/Formal,1300,,false,Nuevo,4.4,6,2023-07-07 04:07:44,,0,5,"Un acierto total, justo lo que buscaba y a un excelente precio.",2023-08-20 11:07:44
687fb20a4cc6239222226280,2023-04-21 04:22:47,renta,Completada,1500,efectivo,regina.ortega@example.com,1234567826,Tlachinol,687e0d118639b437a0e4875b,Vestido de Fiesta Dorado con Lentejuelas,S,Dorado,Todo el Año,1,Fiesta,,1500,false,Nuevo,4.9,7,2023-04-21 17:22:47,2023-05-07 17:22:47,0,5,"Quedó perfecto para la ocasión, muy contenta con la compra/renta.",2023-05-24 04:22:47
687fb20a4cc6239222226281,2023-02-26 12:56:48,Venta,Completada,2144,efectivo,elena.ramirez@example.com,1234567899,Guazalingo,687c1819555de7433ad30a97,Vestido Corto Negro Brillante de Fiesta,S,Negro,Todo el Año,1,Fiesta,,390,false,Excelente,4.2,8,2023-02-26 19:56:48,,0,2,"No fue mi favorito, pero sirvió para la ocasión.",2023-04-10 12:56:48
687fb20a4cc6239222226282,2023-05-18 09:19:46,Venta,Completada,3200,efectivo,elena.ramirez@example.com,1234567899,Guazalingo,687c1a2c555de7433ad30aa5,Vestido Largo Negro con Encaje y Tirantes Gruesos,M,Negro,Todo el Año,1,De Noche,3200,,false,Nuevo,4.8,20,2023-05-18 16:19:46,,0,2,"La experiencia fue regular, no estoy segura de volver a rentar.",2023-06-07 09:19:46
687fb20a4cc6239222226283,2023-06-12 06:07:50,renta,Completada,902,transferencia_bancaria,lucia.torres@example.com,1234567811,Guazalingo,687e0dd08639b437a0e48791,Vestido Bohemio con Estampado Paisley,L,Terracota/Azul,"Primavera, Verano, Otoño",1,Bohemio,1100,,false,Nuevo,4.3,8,2023-06-12 10:07:50,2023-06-23 10:07:50,0,5,"Quedó perfecto para la ocasión, muy contenta con la compra/renta.",2023-07-15 06:07:50
687fb20a4cc6239222226284,2023-01-05 06:44:31,renta,Completada,500,tarjeta_debito,gabriela.silva@example.com,1234567821,Atlapeza,687e0d4b8639b437a0e4877c,Vestido Kimono Estampado Japonés,L,Multicolor,"Primavera, Verano",1,Casual/Formal,1300,,false,Nuevo,4.4,6,2023-01-05 14:44:31,2023-01-18 14:44:31,0,5,"Me fascinó cómo me quedó, ¡lo recomiendo a todas mis amigas!",2023-01-26 06:44:31
687fb20a4cc6239222226285,2023-06-10 07:05:45,Venta,Completada,18000,tarjeta_debito,eduardocasrtro110@gmail.com,554706,Huejutla de Reyes,687e0dd08639b437a0e48785,Vestido de Novia Corte A con Pedrería,M,Marfil,Todo el Año,1,Nupcial,18000,6500,false,Nuevo,5,28,2023-06-10 15:05:45,,0,5,"Quedó perfecto para la ocasión, muy contenta con la compra/renta.",2023-07-15 07:05:45
687fb20a4cc6239222226287,2023-12-20 03:33:29,renta,Completada,6000,efectivo,camila.gonzalez@email.com,5534567890,Huejutla de Reyes,687e0dd08639b437a0e487a1,Vestido de Novia Estilo A-Line Clásico,L,Blanco Roto,Todo el Año,1,Nupcial,17000,6000,false,Nuevo,4.8,25,2023-12-20 08:33:29,2024-01-03 08:33:29,64,5,"El vestido superó mis expectativas, ¡lo recomiendo totalmente!",2024-01-20 03:33:29
687fb20a4cc6239222226288,2023-05-08 07:14:08,renta,Completada,1100,transferencia_bancaria,valentina.rodriguez@email.com,5587654321,Guazalingo,687e0d4b8639b437a0e48772,Vestido de Cóctel con Flecos,S,Plata,Todo el Año,1,Fiesta,,1100,false,Nuevo,4.5,8,2023-05-09 03:14:08,2023-05-19 03:14:08,0,4,"Me fascinó cómo me quedó, ¡lo recomiendo a todas mis amigas!",2023-05-24 07:14:08
687fb20a4cc6239222226289,2023-09-24 07:47:41,Venta,Completada,1100,tarjeta_credito,natalia.vega@example.com,1234567828,Atlapeza,687e0d118639b437a0e4875d,Vestido Bohemio Blanco,M,Blanco,Verano,1,Bohemio,1100,,false,Nuevo,4.3,10,2023-09-24 17:47:41,,0,4,"Un acierto total, justo lo que buscaba y a un excelente precio.",2023-10-10 07:47:41
687fb20a4cc623922222628a,2023-05-02 08:39:21,renta,Completada,688,tarjeta_debito,eduardocasrtro110@gmail.com,554706,Huejutla de Reyes,687e0dd08639b437a0e487c9,Vestido Largo de Gasa con Estampado de Geométrico,L,Gris/Negro,Todo el Año,1,Formal/Casual,1400,,false,Nuevo,4.3,8,2023-05-02 10:39:21,2023-05-16 10:39:21,0,4,"Me fascinó cómo me quedó, ¡lo recomiendo a todas mis amigas!",2023-05-13 08:39:21
687fb20a4cc623922222628b,2023-05-11 06:45:15,Venta,Completada,1800,transferencia_bancaria,alejandra.paredes@example.com,1234567827,Huejutla de Reyes,687e0dd08639b437a0e487b8,Vestido Midi de Mangas Largas Transparente,M,Negro,Todo el Año,1,Cóctel,1800,,false,Nuevo,4.4,9,2023-05-12 01:45:15,,0,1,El vestido se veía mejor en las fotos. Necesitaba algunos ajustes.,2023-05-24 06:45:15
687fb20a4cc623922222628c,2023-07-11 05:20:35,Venta,Completada,4000,tarjeta_credito,patricia.guzman@example.com,1234567819,Guazalingo,687c108a555de7433ad30a6b,Escarlata Real,M,Rojo,Todo el Año,1,De Noche,4000,,false,Nuevo,4.9,25,2023-07-12 04:20:35,,0,4,¡Excelente vestido! Me encantó el servicio en el local.,2023-08-10 05:20:35
687fb20a4cc623922222628d,2023-05-21 11:41:53,renta,Completada,1129,transferencia_bancaria,ia.perez@example.com,1234567897,Chalma,687c1f87555de7433ad30ac4,Vestido Largo Plateado con Lentejuelas,M,Gris,Todo el Año,1,De Noche,3600,,false,Nuevo,4.7,19,2023-05-22 03:41:53,2023-06-01 03:41:53,0,4,¡Absolutamente precioso! Recibí muchos cumplidos.,2023-06-26 11:41:53
687fb20a4cc623922222628e,2023-07-22 03:28:29,renta,Completada,1107,transferencia_bancaria,lucia.torres@example.com,1234567811,Guazalingo,687e0dd08639b437a0e4879c,Vestido de Punto Grueso con Cuello Redondo,M,Negro,Invierno,1,Casual,1350,,false,Nuevo,3.7,10,2023-07-22 14:28:29,2023-08-11 14:28:29,0,1,El vestido se veía mejor en las fotos. Necesitaba algunos ajustes.,2023-08-07 03:28:29
687fb20a4cc623922222628f,2023-04-06 07:55:53,renta,Completada,800,tarjeta_credito,lucia.torres@example.com,1234567811,Guazalingo,687e0dd08639b437a0e48790,Vestido de Fiesta con Escote Asimétrico,M,Verde Esmeralda,Todo el Año,1,Fiesta,2300,800,false,Nuevo,4.6,10,2023-04-06 17:55:53,2023-04-20 17:55:53,0,5,"El vestido superó mis expectativas, ¡lo recomiendo totalmente!",2023-04-23 07:55:53
687fb20a4cc6239222226290,2023-10-27 11:44:49,Venta,Completada,3938,transferencia_bancaria,gabriela.silva@example.com,1234567821,Atlapeza,687c1819555de7433ad30a97,Vestido Corto Negro Brillante de Fiesta,S,Negro,Todo el Año,1,Fiesta,,390,false,Excelente,4.2,8,2023-10-27 23:44:49,,0,4,"Un acierto total, justo lo que buscaba y a un excelente precio.",2023-11-04 11:44:49
687fb20a4cc6239222226291,2023-05-16 09:17:26,renta,Completada,2000,tarjeta_debito,ximena.hernandez@email.com,5523456789,Calnali,687e0d118639b437a0e48764,Vestido de Gala Rosa Pastel,M,Rosa Pastel,Todo el Año,1,Gala,,2000,false,Nuevo,4.8,13,2023-05-16 16:17:26,2023-05-23 16:17:26,0,2,"Hubo un pequeño detalle con el vestido, pero fue manejable.",2023-06-25 09:17:26
687fb20a4cc6239222226292,2023-11-05 06:47:48,renta,Completada,845,tarjeta_debito,ia.perez@example.com,1234567897,Chalma,687e0d4b8639b437a0e4877f,Vestido de Tirantes con Estampado de Lunares,S,Negro/Blanco,Verano,1,Casual,890,,false,Nuevo,4,9,2023-11-06 00:47:48,2023-11-25 00:47:48,0,4,Un diseño hermoso y la atención fue de primera. Volveré sin duda.,2023-12-18 06:47:48
687fb20a4cc6239222226293,2023-10-23 10:47:20,renta,Completada,600,efectivo,sheldon@gmail.com,5551234567,Platón Sánchez,687e0d118639b437a0e4875a,Vestido Largo Azul Cielo,M,Azul Cielo,"Primavera, Verano",1,Formal,1800,600,false,Nuevo,4.6,12,2023-10-23 19:47:20,2023-11-01 19:47:20,0,5,"Me fascinó cómo me quedó, ¡lo recomiendo a todas mis amigas!",2023-12-01 10:47:20
687fb20a4cc6239222226294,2023-10-09 05:34:09,Venta,Completada,8000,efectivo,valeria.rojas@example.com,1234567823,Atlapeza,687e0dd08639b437a0e487b3,Vestido de Novia Corto para Elopement,S,Blanco Puro,Todo el Año,1,Nupcial,8000,,false,Nuevo,4.6,7,2023-10-09 12:34:09,,0,4,"Quedó perfecto para la ocasión, muy contenta con la compra/renta.",2023-10-16 05:34:09
687fb20a4cc6239222226295,2023-12-20 05:12:16,Venta,Completada,1300,tarjeta_debito,ximena.hernandez@email.com,5523456789,Calnali,687e0dd08639b437a0e487b2,Vestido de Punto Grueso con Cuello Alto,M,Gris,Invierno,1,Casual,1300,,false,Nuevo,3.7,6,2023-12-21 00:12:16,,0,3,"El vestido está bien, cumplió con lo esperado.",2024-01-25 05:12:16
687fb20a4cc6239222226296,2023-04-23 05:17:52,Venta,Completada,3200,efectivo,lucia.torres@example.com,1234567811,Guazalingo,687e0d4b8639b437a0e48774,Vestido de Gala con Escote en V Profundo,M,Negro,Todo el Año,1,Gala,3200,1200,false,Nuevo,4.9,11,2023-04-23 13:17:52,,0,5,¡Excelente vestido! Me encantó el servicio en el local.,2023-05-27 05:17:52
687fb20a4cc6239222226297,2023-06-09 06:53:34,renta,Completada,328,transferencia_bancaria,alejandra.paredes@example.com,1234567827,Huejutla de Reyes,687e0dd08639b437a0e487ac,Vestido de Punto de Cuello Alto sin Mangas,M,Beige,"Otoño, Invierno",1,Casual,1150,,false,Nuevo,3.8,9,2023-06-09 16:53:34,2023-06-25 16:53:34,0,4,"El vestido superó mis expectativas, ¡lo recomiendo totalmente!",2023-07-15 06:53:34
687fb20a4cc6239222226298,2023-06-03 12:19:26,renta,Completada,522,transferencia_bancaria,valeria.rojas@example.com,1234567823,Atlapeza,687e0dd08639b437a0e487aa,Vestido Casual con Estampado Geométrico,M,Gris/Amarillo,"Primavera, Otoño",1,Casual,1000,,false,Nuevo,4.1,12,2023-06-03 23:19:26,2023-06-16 23:19:26,89,5,"La tela es de muy buena calidad, y el vestido es aún más bonito en persona.",2023-06-13 12:19:26
687fb20a4cc6239222226299,2023-11-04 06:54:59,renta,Completada,2800,tarjeta_debito,carmen.morales@example.com,1234567813,Huejutla de Reyes,687e0dd08639b437a0e487ad,Vestido de Gala con Capa Flotante,M,Negro,Todo el Año,1,Gala,,2800,false,Nuevo,5,18,2023-11-04 23:54:59,2023-11-10 23:54:59,0,4,"Un acierto total, justo lo que buscaba y a un excelente precio.",2023-11-25 06:54:59
687fb20a4cc623922222629a,2023-05-18 06:07:38,Venta,Completada,941,tarjeta_credito,20221076@uthh.edu.mx,7712232323,San Felipe Orizatlán,687c205b555de7433ad30aca,Conjunto Satinado Celeste de Top y Falda,S,Celeste,"Primavera, Verano",1,De Noche,,340,false,Nuevo,4.5,10,2023-05-18 14:07:38,,0,5,¡Excelente vestido! Me encantó el servicio en el local.,2023-06-08 06:07:38
687fb20a4cc623922222629b,2023-02-04 05:05:04,renta,Completada,900,transferencia_bancaria,daniela.mendoza@example.com,1234567822,Huejutla de Reyes,687e0d118639b437a0e48760,Vestido de Graduación Morado,L,Morado,Todo el Año,1,De Noche,2800,900,false,Nuevo,4.7,14,2023-02-04 15:05:04,2023-02-20 15:05:04,0,1,"No fue mi favorito, pero sirvió para la ocasión.",2023-03-02 05:05:04
687fb20a4cc623922222629c,2023-01-24 10:16:30,renta,Completada,807,efectivo,isabel.vargas@example.com,1234567815,Choconamel,687e0dd08639b437a0e4878a,Vestido de Invierno de Cuadros Tartán,M,Rojo/Verde,Invierno,1,Casual,1250,,false,Nuevo,4.1,7,2023-01-25 08:16:30,2023-02-04 08:16:30,0,4,"Me fascinó cómo me quedó, ¡lo recomiendo a todas mis amigas!",2023-03-04 10:16:30
687fb20a4cc623922222629d,2023-12-25 07:59:41,renta,Completada,789,tarjeta_debito,ia.perez@example.com,1234567897,Chalma,687e0d4b8639b437a0e4876d,Vestido Camisero a Cuadros Escoceses,L,Rojo/Negro,"Otoño, Invierno",1,Casual,1100,,false,Nuevo,3.9,7,2023-12-26 06:59:41,2024-01-10 06:59:41,0,4,"Quedó perfecto para la ocasión, muy contenta con la compra/renta.",2024-02-02 07:59:41
687fb20a4cc623922222629e,2023-12-24 06:03:31,renta,Completada,1300,transferencia_bancaria,patricia.guzman@example.com,1234567819,Guazalingo,687e0dd08639b437a0e487c8,Vestido de Fiesta Mini con Lentejuelas Doradas,S,Dorado,Todo el Año,1,Fiesta,,1300,false,Nuevo,4.7,11,2023-12-24 12:03:31,2023-12-30 12:03:31,0,1,Podría mejorar la limpieza/condición del vestido al entregarlo.,2024-01-11 06:03:31
687fb20a4cc623922222629f,2023-08-18 10:41:37,renta,Completada,900,efectivo,ech19413070170002@gmail.com,7718858193,Calnali,687e0dd08639b437a0e48793,Vestido de Noche con Cola de Pato,M,Borgoña,Todo el Año,1,De Noche,2800,900,false,Nuevo,4.8,12,2023-08-19 10:41:37,2023-09-02 10:41:37,0,4,"Un acierto total, justo lo que buscaba y a un excelente precio.",2023-08-27 10:41:37
687fb20a4cc62392222262a0,2023-10-12 06:18:16,renta,Completada,1359,efectivo,patricia.guzman@example.com,1234567819,Guazalingo,687e0d118639b437a0e48765,Vestido Camisero a Rayas,S,Azul/Blanco,"Primavera, Verano",1,Casual,750,,false,Nuevo,3.8,4,2023-10-12 11:18:16,2023-10-24 11:18:16,0,1,"Hubo un pequeño detalle con el vestido, pero fue manejable.",2023-11-20 06:18:16
687fb20a4cc62392222262a1,2023-07-17 07:43:13,renta,Completada,600,tarjeta_credito,valeria.rojas@example.com,1234567823,Atlapeza,67e059988bbb15e17ae334b4,Vestido de Noche Meirius Largo Verde con Hombro Descubierto,XL,verde,Todo el Año,1,De Noche,1000,,false,Nuevo,4,8,2023-07-18 03:43:13,2023-07-25 03:43:13,0,3,"El vestido es lindo, pero la comunicación podría mejorar.",2023-07-24 07:43:13
687fb20a4cc62392222262a2,2023-07-26 05:53:44,renta,Completada,600,transferencia_bancaria,ia.perez@example.com,1234567897,Chalma,687e0d118639b437a0e4875a,Vestido Largo Azul Cielo,M,Azul Cielo,"Primavera, Verano",1,Formal,1800,600,false,Nuevo,4.6,12,2023-07-26 18:53:44,2023-08-01 18:53:44,41,3,"El vestido es lindo, pero la comunicación podría mejorar.",2023-08-30 05:53:44
687fb20a4cc62392222262a3,2023-04-19 07:46:28,renta,Completada,343,tarjeta_credito,valentina.rodriguez@email.com,5587654321,Guazalingo,687e0dd08639b437a0e487a4,Vestido Corto de Lino Blanco,L,Blanco,Verano,1,Casual,950,,false,Nuevo,4.2,10,2023-04-19 10:46:28,2023-04-27 10:46:28,66,5,"Un acierto total, justo lo que buscaba y a un excelente precio.",2023-05-07 07:46:28
687fb20a4cc62392222262a4,2023-11-03 11:31:45,Venta,Completada,1750,transferencia_bancaria,20221076@uthh.edu.mx,7712232323,San Felipe Orizatlán,687e0d118639b437a0e48766,Vestido Asimétrico Negro,M,Negro,Todo el Año,1,Fiesta,1750,,false,Nuevo,4.5,9,2023-11-03 21:31:45,,0,4,¡Excelente vestido! Me encantó el servicio en el local.,2023-12-12 11:31:45
687fb20a4cc62392222262a5,2023-09-19 12:47:18,renta,Completada,1300,efectivo,sheldon@gmail.com,5551234567,Platón Sánchez,687e0dd08639b437a0e487c8,Vestido de Fiesta Mini con Lentejuelas Doradas,S,Dorado,Todo el Año,1,Fiesta,,1300,false,Nuevo,4.7,11,2023-09-19 20:47:18,2023-10-06 20:47:18,0,2,El vestido no cumplió con mis expectativas de calidad.,2023-10-04 12:47:18
687fb20a4cc62392222262a6,2023-05-28 06:18:10,renta,Completada,1800,tarjeta_credito,daniela.mendoza@example.com,1234567822,Huejutla de Reyes,687e0d4b8639b437a0e4876e,Vestido de Noche con Cola de Sirena y Bordados,M,Azul Marino,Todo el Año,1,De Noche,,1800,false,Nuevo,4.9,15,2023-05-28 12:18:10,2023-06-15 12:18:10,0,4,¡Excelente vestido! Me encantó el servicio en el local.,2023-06-26 06:18:10
687fb20a4cc62392222262a7,2023-11-24 03:25:51,renta,Completada,850,tarjeta_credito,isabel.vargas@example.com,1234567815,Choconamel,687e0d4b8639b437a0e4877b,Vestido de Noche con Abertura Lateral,S,Rojo Oscuro,Todo el Año,1,De Noche,2600,850,false,Nuevo,4.8,12,2023-11-24 23:25:51,2023-11-29 23:25:51,0,2,El vestido no cumplió con mis expectativas de calidad.,2023-12-16 03:25:51
687fb20a4cc62392222262a8,2023-05-23 05:44:11,renta,Completada,600,efectivo,gabriela.silva@example.com,1234567821,Atlapeza,687e0dd08639b437a0e487af,Vestido de Cóctel con Escote Peter Pan,S,Rosa Pastel,Todo el Año,1,Cóctel,1650,600,false,Nuevo,4.5,7,2023-05-23 11:44:11,2023-05-28 11:44:11,0,2,"Hubo un pequeño detalle con el vestido, pero fue manejable.",2023-06-18 05:44:11
687fb20a4cc62392222262a9,2023-05-06 03:46:34,Venta,Completada,1728,efectivo,hiasd12e@gmail.com,7713554706,Atlapeza,687c1680555de7433ad30a8f,Vestido Verde Esmeralda en Capas,L,Verde Esmeralda,Todo el Año,1,De Noche,,320,false,Excelente,4.6,13,2023-05-06 17:46:34,,0,4,Un diseño hermoso y la atención fue de primera. Volveré sin duda.,2023-06-19 03:46:34
687fb20a4cc62392222262aa,2023-04-09 07:23:44,renta,Completada,1800,tarjeta_credito,eduardocasrtro110@gmail.com,554706,Huejutla de Reyes,687e0dd08639b437a0e487a7,Vestido de Noche con Aberturas en la Cintura,S,Negro,Todo el Año,1,De Noche,,1800,false,Nuevo,4.8,13,2023-04-09 13:23:44,2023-04-17 13:23:44,0,5,"Me fascinó cómo me quedó, ¡lo recomiendo a todas mis amigas!",2023-05-20 07:23:44
687fb20a4cc62392222262ab,2023-08-17 12:28:26,renta,Completada,538,tarjeta_debito,carmen.morales@example.com,1234567813,Huejutla de Reyes,67e0844f9e883380830c5744,Vestido de Noche Meirius Largo Tinto con Tirantes,XL,rubi,"Otoño, Invierno, Todo el Año",1,De Noche,1000,,false,Nuevo,4.2,9,2023-08-18 09:28:26,2023-08-31 09:28:26,0,5,¡Excelente vestido! Me encantó el servicio en el local.,2023-09-14 12:28:26
687fb20a4cc62392222262ac,2023-12-03 07:41:40,renta,Completada,381,tarjeta_credito,isabel.vargas@example.com,1234567815,Choconamel,687c1a2c555de7433ad30aa5,Vestido Largo Negro con Encaje y Tirantes Gruesos,M,Negro,Todo el Año,1,De Noche,3200,,false,Nuevo,4.8,20,2023-12-03 08:41:40,2023-12-07 08:41:40,0,5,Un diseño hermoso y la atención fue de primera. Volveré sin duda.,2024-01-03 07:41:40
